{
  "$schema": "https://json-schema.org/draft/2020-12/schema",
  "$id": "rqunit/interfaces/actual-surface.schema.json",
  "title": "ActualSurface",
  "description": "What a codebase REALLY exposes, in manifest vocabulary. Produced by a per-stack adapter (Rust: syn; JVM: annotation scan; Node: router table), consumed by `rqunit conformance`, which owns the diff against the manifest. Adapters extract and never judge: no adapter decides what a divergence means.",
  "type": "object",
  "additionalProperties": false,
  "required": [
    "contract_version",
    "generated_by",
    "services"
  ],
  "properties": {
    "contract_version": {
      "const": 1
    },
    "generated_by": {
      "type": "string",
      "minLength": 1,
      "description": "Adapter name and version \u2014 the report attributes findings to their extractor."
    },
    "services": {
      "type": "object",
      "description": "Keyed by manifest service slug. A service absent here is not reconciled at all (no adapter covers it); a service present with empty surfaces asserts the code exposes nothing.",
      "propertyNames": {
        "pattern": "^[a-z][a-z0-9-]*$"
      },
      "additionalProperties": {
        "type": "object",
        "additionalProperties": false,
        "properties": {
          "endpoints": {
            "type": "array",
            "items": {
              "type": "object",
              "additionalProperties": false,
              "required": [
                "method",
                "path",
                "access"
              ],
              "properties": {
                "method": {
                  "enum": [
                    "GET",
                    "POST",
                    "PUT",
                    "PATCH",
                    "DELETE",
                    "HEAD",
                    "OPTIONS",
                    "ANY"
                  ]
                },
                "path": {
                  "type": "string",
                  "pattern": "^/"
                },
                "access": {
                  "type": "string",
                  "description": "Structural access tier as the code composes it (which middleware stack the route is mounted under). Membership in access_tiers is the manifest's business, not the adapter's."
                },
                "inbound": {
                  "$ref": "#/$defs/observed_shape"
                },
                "outbound": {
                  "$ref": "#/$defs/observed_shape"
                }
              }
            }
          },
          "messages": {
            "type": "array",
            "items": {
              "type": "object",
              "additionalProperties": false,
              "required": [
                "subject"
              ],
              "properties": {
                "subject": {
                  "type": "string",
                  "minLength": 1
                },
                "direction": {
                  "enum": [
                    "inbound",
                    "outbound"
                  ],
                  "description": "Optional: adapters that cannot determine direction omit it, and the reconciler falls back to presence-only matching."
                }
              }
            }
          },
          "audit_events": {
            "type": "array",
            "description": "Audit codes the code actually emits. An audit record is an interface surface with a retention window and mandatory absences, and until now nothing reconciled it: a service could declare twenty events, emit none, and pass every gate. Observation only \u2014 whether a missing emission is a defect is the framework's judgment (CF10/CF11).",
            "items": {
              "type": "object",
              "additionalProperties": false,
              "required": [
                "code"
              ],
              "properties": {
                "code": {
                  "type": "string",
                  "minLength": 1,
                  "description": "The code as the emitting call site names it. A probe proves the call site EXISTS; it cannot prove the line ever runs \u2014 dead code and never-taken branches both pass, which is why the report distinguishes proof classes."
                }
              }
            }
          }
        }
      }
    },
    "covers": {
      "type": "array",
      "uniqueItems": true,
      "items": {
        "enum": [
          "endpoints",
          "messages",
          "channels",
          "audit_events"
        ]
      },
      "description": "Which surface families this artifact EXAMINED. A probe reads one framework and finds one family, so an artifact from a NATS probe makes no claim about routes \u2014 and without this key the reconciler reads that silence as 'the code serves no endpoints' and reports every declared route as unserved. Omit to mean 'everything', which is what a single whole-stack extractor asserts and what every pre-existing artifact meant."
    }
  },
  "$defs": {
    "observed_shape": {
      "type": "object",
      "additionalProperties": false,
      "description": "What the code DECLARES it carries in this direction \u2014 the handler's request or response type and that type's field names. Optional at every level: an adapter that cannot resolve a handler to a type omits the block, and one that can name the type but not walk its fields omits `fields`. Omission means 'not observed', never 'empty' \u2014 so a stack whose extractor cannot see shapes degrades to presence-only matching rather than reporting every declared field as missing.",
      "properties": {
        "type_name": {
          "type": "string",
          "minLength": 1,
          "description": "The declared type, e.g. 'MeResponse'. Identity only: the reconciler uses it to notice that two routes serve the SAME type while their manifests declare different censuses (CF8). The adapter does not decide whether that is wrong."
        },
        "fields": {
          "type": "array",
          "uniqueItems": true,
          "items": {
            "type": "string",
            "minLength": 1
          },
          "description": "Field names the type declares, dotted for nesting, in manifest vocabulary. Names only: whether a field is required, nullable, or must not leak is a runtime and requirement question the manifest answers and tests prove \u2014 an adapter reporting it would be judging."
        }
      }
    }
  }
}
