{
  "contract_version": 1,
  "generated_by": "rqunit-adapter-rust 0.1.0",
  "covers": ["endpoints", "messages", "audit_events"],
  "services": {
    "service-orders": {
      "endpoints": [
        { "method": "GET", "path": "/api/v1/orders/{id}", "access": "protected", "outbound": { "type_name": "OrderView", "fields": ["id", "total", "total.amount", "total.currency", "placed_at"] } },
        { "method": "PATCH", "path": "/api/v1/orders/{id}/amend", "access": "protected" },
        { "method": "POST", "path": "/api/v1/orders/bulk", "access": "protected", "inbound": { "type_name": "CancelRequest", "fields": ["reason"] } },
        { "method": "POST", "path": "/api/v1/orders/{id}/cancel", "access": "protected", "inbound": { "type_name": "CancelRequest", "fields": ["reason"] }, "outbound": { "type_name": "OrderView", "fields": ["id", "total", "total.amount", "total.currency", "placed_at"] } }
      ],
      "messages": [
        { "subject": "orders.cancelled", "direction": "outbound" },
        { "subject": "orders.placed", "direction": "outbound" }
      ],
      "audit_events": [
        { "code": "orders.cancelled" }
      ]
    }
  }
}
